{
  "contract_version": 1,
  "episode_id": "2013-12.01",
  "title": "The Homes We Leave Behind",
  "segments": [
    {
      "segment_id": "m1-s001",
      "speaker": "connector",
      "kind": "host_dialogue",
      "text": "\"I have merely been transplanted from one scene of student-life to another.\" That's a young man writing from Cambridge in 1859, talking himself into believing that leaving home isn't really leaving home.",
      "source_story_ids": [
        "story-9608b65eb8ddfa6ae62b0e39"
      ],
      "delivery": {
        "tone": "reflective, quiet"
      },
      "pause_after_ms": 600
    },
    {
      "segment_id": "m1-s002",
      "speaker": "curious_guide",
      "kind": "host_dialogue",
      "text": "He doesn't even convince himself, though. A few lines later he admits he's going to be homesick on long evenings, longing for something home-like to talk to and smile at.",
      "source_story_ids": [
        "story-9608b65eb8ddfa6ae62b0e39"
      ],
      "delivery": {
        "tone": "warm, knowing"
      },
      "pause_after_ms": 400
    },
    {
      "segment_id": "m1-s003",
      "speaker": "archive_nerd",
      "kind": "host_dialogue",
      "text": "And we only have those words because a letter survived long enough to be printed in a book, and that book survived long enough to be scanned, and the scan got crawled onto the internet. One hundred and fifty-four years from pen to pixel.",
      "source_story_ids": [
        "story-9608b65eb8ddfa6ae62b0e39"
      ],
      "delivery": {
        "tone": "marveling, precise"
      },
      "pause_after_ms": 800
    },
    {
      "segment_id": "m1-s004",
      "speaker": "curious_guide",
      "kind": "host_dialogue",
      "text": "Welcome to The Homes We Leave Behind. I'm Maya.",
      "source_story_ids": [],
      "delivery": {
        "tone": "bright, welcoming"
      },
      "pause_after_ms": 200
    },
    {
      "segment_id": "m1-s005",
      "speaker": "archive_nerd",
      "kind": "host_dialogue",
      "text": "I'm Theo.",
      "source_story_ids": [],
      "delivery": {},
      "pause_after_ms": 200
    },
    {
      "segment_id": "m1-s006",
      "speaker": "connector",
      "kind": "host_dialogue",
      "text": "And I'm Lina.",
      "source_story_ids": [],
      "delivery": {},
      "pause_after_ms": 300
    },
    {
      "segment_id": "m1-s008",
      "speaker": "archive_nerd",
      "kind": "host_dialogue",
      "text": "Quick note on where all this comes from: every source today was grabbed by a web crawler in December 2013. That's when it was captured, not necessarily when it was written. That 1859 letter? It was sitting on the Internet Archive as a raw text file—an OCR dump of a scanned book, complete with broken line breaks and a stray page number header.",
      "source_story_ids": [
        "story-9608b65eb8ddfa6ae62b0e39"
      ],
      "delivery": {
        "tone": "informative, lightly amused"
      },
      "pause_after_ms": 400
    },
    {
      "segment_id": "m1-s009",
      "speaker": "curious_guide",
      "kind": "host_dialogue",
      "text": "Today we're asking what happens when the place you call home becomes a place you can only visit. And that ache turned up everywhere in this archive—old letters, blog posts, a grief journal on a health website.",
      "source_story_ids": [
        "story-9608b65eb8ddfa6ae62b0e39",
        "story-0df1f0c21c6c8791e42dba65"
      ],
      "delivery": {
        "tone": "warm, setting the stage"
      },
      "pause_after_ms": 300
    },
    {
      "segment_id": "m1-s011",
      "speaker": "curious_guide",
      "kind": "quote",
      "text": "the idea of going away for good and all, and always hereafter being at home only as a visitor.",
      "source_story_ids": [
        "story-9608b65eb8ddfa6ae62b0e39"
      ],
      "delivery": {
        "tone": "measured, letting the words land"
      },
      "pause_after_ms": 700
    },
    {
      "segment_id": "m1-s013",
      "speaker": "connector",
      "kind": "host_dialogue",
      "text": "That same feeling shows up a century and a half later on a Blogspot page. The author goes by \"Saudade\"—the Portuguese word for a longing that never quite resolves.",
      "source_story_ids": [
        "story-7ac236ec06ced47546d91a19"
      ],
      "delivery": {
        "tone": "intrigued"
      },
      "pause_after_ms": 300
    },
    {
      "segment_id": "m1-s014",
      "speaker": "curious_guide",
      "kind": "host_dialogue",
      "text": "They're writing about leaving Cape Verde after volunteering there, and they call it one of the saddest days of their life. Years later, they still think about it every single day.",
      "source_story_ids": [
        "story-7ac236ec06ced47546d91a19"
      ],
      "delivery": {
        "tone": "moved"
      },
      "pause_after_ms": 300
    },
    {
      "segment_id": "m1-s015",
      "speaker": "archive_nerd",
      "kind": "quote",
      "text": "There never was a time when I was more myself, more comfortable with the skin I wore, the people I'd seen, the place I'd visited.",
      "source_story_ids": [
        "story-7ac236ec06ced47546d91a19"
      ],
      "delivery": {
        "tone": "sincere, letting the sentiment breathe"
      },
      "pause_after_ms": 600
    },
    {
      "segment_id": "m1-s016",
      "speaker": "connector",
      "kind": "host_dialogue",
      "text": "What gets me is that Saudade's home isn't the place they grew up. It's a place they chose and then had to leave. And that kind of homesickness—try explaining that to someone.",
      "source_story_ids": [
        "story-7ac236ec06ced47546d91a19"
      ],
      "delivery": {
        "tone": "perceptive"
      },
      "pause_after_ms": 300
    },
    {
      "segment_id": "m1-s017",
      "speaker": "archive_nerd",
      "kind": "host_dialogue",
      "text": "The blog itself is a little mystery. The archive shows exactly one post. The blog's called \"Raskalnikov\"—yes, Dostoevsky—but the display name is Saudade. Two literary personas sharing one page. And there are Cape Verdean Creole phrases woven into the English with no translation at all.",
      "source_story_ids": [
        "story-7ac236ec06ced47546d91a19"
      ],
      "delivery": {
        "tone": "genuinely curious"
      },
      "pause_after_ms": 300
    },
    {
      "segment_id": "m1-s018",
      "speaker": "curious_guide",
      "kind": "host_dialogue",
      "text": "Maybe they weren't writing for us. Maybe they were writing for the friends they name at the end of the post—people still in Cape Verde who'd understand every word.",
      "source_story_ids": [
        "story-7ac236ec06ced47546d91a19"
      ],
      "delivery": {
        "tone": "gentle"
      },
      "pause_after_ms": 400
    },
    {
      "segment_id": "m1-s019",
      "speaker": "connector",
      "kind": "host_dialogue",
      "text": "Okay, now here's where Theo found something that floored me. In the same crawl—another Internet Archive text file, another OCR scan with page numbers still embedded—there's a letter from Beethoven.",
      "source_story_ids": [
        "story-bc88fb883cd14b8f55e78065"
      ],
      "delivery": {
        "tone": "building energy"
      },
      "pause_after_ms": 300
    },
    {
      "segment_id": "m1-s020",
      "speaker": "archive_nerd",
      "kind": "host_dialogue",
      "text": "It's addressed to Stephan von Breuning. Beethoven is writing about how his deafness keeps him from traveling—he can't go see the scenery of his fatherland, he can't marry. And then there's this line—",
      "source_story_ids": [
        "story-bc88fb883cd14b8f55e78065"
      ],
      "delivery": {
        "tone": "setting up carefully"
      },
      "pause_after_ms": 200
    },
    {
      "segment_id": "m1-s021",
      "speaker": "connector",
      "kind": "quote",
      "text": "Oh ! I could span the world were I only free from this ! I feel that my youth is only now commencing.",
      "source_story_ids": [
        "story-bc88fb883cd14b8f55e78065"
      ],
      "delivery": {
        "tone": "aching, deliberate"
      },
      "pause_after_ms": 700
    },
    {
      "segment_id": "m1-s022",
      "speaker": "curious_guide",
      "kind": "host_dialogue",
      "text": "He's homesick for a life he can't get to. Not a specific house—a whole future his deafness has walled off.",
      "source_story_ids": [
        "story-bc88fb883cd14b8f55e78065"
      ],
      "delivery": {
        "tone": "quiet, struck",
        "audio_tags": [
          "exhales softly"
        ]
      },
      "pause_after_ms": 400
    },
    {
      "segment_id": "m1-s023",
      "speaker": "archive_nerd",
      "kind": "host_dialogue",
      "text": "And the digital version of the letter just cuts off mid-sentence. His closing words, his signature—gone. The scan or the extraction stopped before the end. So even this archived copy of a published copy of a private letter is incomplete.",
      "source_story_ids": [
        "story-bc88fb883cd14b8f55e78065"
      ],
      "delivery": {
        "tone": "pointed, wry"
      },
      "pause_after_ms": 400
    },
    {
      "segment_id": "m1-s024",
      "speaker": "connector",
      "kind": "host_dialogue",
      "text": "Then there's Brooke Davidoff. And her story brings all of this into the present tense. She wrote a post called \"Homesick\" after her father died.",
      "source_story_ids": [
        "story-0df1f0c21c6c8791e42dba65"
      ],
      "delivery": {
        "tone": "careful, shifting down"
      },
      "pause_after_ms": 500
    },
    {
      "segment_id": "m1-s025",
      "speaker": "curious_guide",
      "kind": "host_dialogue",
      "text": "She's living far from southern California, where her mother and her father's house are. The family owns the house in Wildomar together, but nobody can afford the mortgage, and nobody lives nearby.",
      "source_story_ids": [
        "story-0df1f0c21c6c8791e42dba65"